{
  "schemaVersion": "aidc.robot.devices/0.1",
  "modelId": "aidc.microduck.native12",
  "modelRevision": "p4-r1",
  "devices": [
    {
      "deviceId": "actuator-left_hip_yaw",
      "deviceType": "actuator",
      "model": "AIDCRobotics.Actuators.IdealTorque",
      "jointId": "left_hip_yaw",
      "commandKind": "torque",
      "gearRatio": 320,
      "rotorInertia_kg_m2": 0.0005,
      "viscousDamping_Nm_s_rad": 0.001,
      "effortLimit_Nm": 1.176798,
      "speedLimit_rad_s": 9.42477796076938,
      "powerDeviceId": "battery"
    },
    {
      "deviceId": "actuator-left_hip_roll",
      "deviceType": "actuator",
      "model": "AIDCRobotics.Actuators.IdealTorque",
      "jointId": "left_hip_roll",
      "commandKind": "torque",
      "gearRatio": 320,
      "rotorInertia_kg_m2": 0.0005,
      "viscousDamping_Nm_s_rad": 0.001,
      "effortLimit_Nm": 1.176798,
      "speedLimit_rad_s": 9.42477796076938,
      "powerDeviceId": "battery"
    },
    {
      "deviceId": "actuator-left_hip_pitch",
      "deviceType": "actuator",
      "model": "AIDCRobotics.Actuators.IdealTorque",
      "jointId": "left_hip_pitch",
      "commandKind": "torque",
      "gearRatio": 320,
      "rotorInertia_kg_m2": 0.0005,
      "viscousDamping_Nm_s_rad": 0.001,
      "effortLimit_Nm": 1.176798,
      "speedLimit_rad_s": 9.42477796076938,
      "powerDeviceId": "battery"
    },
    {
      "deviceId": "actuator-left_knee",
      "deviceType": "actuator",
      "model": "AIDCRobotics.Actuators.IdealTorque",
      "jointId": "left_knee",
      "commandKind": "torque",
      "gearRatio": 320,
      "rotorInertia_kg_m2": 0.0005,
      "viscousDamping_Nm_s_rad": 0.001,
      "effortLimit_Nm": 1.176798,
      "speedLimit_rad_s": 9.42477796076938,
      "powerDeviceId": "battery"
    },
    {
      "deviceId": "actuator-left_ankle",
      "deviceType": "actuator",
      "model": "AIDCRobotics.Actuators.IdealTorque",
      "jointId": "left_ankle",
      "commandKind": "torque",
      "gearRatio": 320,
      "rotorInertia_kg_m2": 0.0005,
      "viscousDamping_Nm_s_rad": 0.001,
      "effortLimit_Nm": 1.176798,
      "speedLimit_rad_s": 9.42477796076938,
      "powerDeviceId": "battery"
    },
    {
      "deviceId": "actuator-neck_pitch",
      "deviceType": "actuator",
      "model": "AIDCRobotics.Actuators.IdealTorque",
      "jointId": "neck_pitch",
      "commandKind": "torque",
      "gearRatio": 320,
      "rotorInertia_kg_m2": 0.0005,
      "viscousDamping_Nm_s_rad": 0.001,
      "effortLimit_Nm": 1.176798,
      "speedLimit_rad_s": 9.42477796076938,
      "powerDeviceId": "battery"
    },
    {
      "deviceId": "actuator-head_yaw",
      "deviceType": "actuator",
      "model": "AIDCRobotics.Actuators.IdealTorque",
      "jointId": "head_yaw",
      "commandKind": "torque",
      "gearRatio": 320,
      "rotorInertia_kg_m2": 0.0005,
      "viscousDamping_Nm_s_rad": 0.001,
      "effortLimit_Nm": 1.176798,
      "speedLimit_rad_s": 9.42477796076938,
      "powerDeviceId": "battery"
    },
    {
      "deviceId": "actuator-right_hip_yaw",
      "deviceType": "actuator",
      "model": "AIDCRobotics.Actuators.IdealTorque",
      "jointId": "right_hip_yaw",
      "commandKind": "torque",
      "gearRatio": 320,
      "rotorInertia_kg_m2": 0.0005,
      "viscousDamping_Nm_s_rad": 0.001,
      "effortLimit_Nm": 1.176798,
      "speedLimit_rad_s": 9.42477796076938,
      "powerDeviceId": "battery"
    },
    {
      "deviceId": "actuator-right_hip_roll",
      "deviceType": "actuator",
      "model": "AIDCRobotics.Actuators.IdealTorque",
      "jointId": "right_hip_roll",
      "commandKind": "torque",
      "gearRatio": 320,
      "rotorInertia_kg_m2": 0.0005,
      "viscousDamping_Nm_s_rad": 0.001,
      "effortLimit_Nm": 1.176798,
      "speedLimit_rad_s": 9.42477796076938,
      "powerDeviceId": "battery"
    },
    {
      "deviceId": "actuator-right_hip_pitch",
      "deviceType": "actuator",
      "model": "AIDCRobotics.Actuators.IdealTorque",
      "jointId": "right_hip_pitch",
      "commandKind": "torque",
      "gearRatio": 320,
      "rotorInertia_kg_m2": 0.0005,
      "viscousDamping_Nm_s_rad": 0.001,
      "effortLimit_Nm": 1.176798,
      "speedLimit_rad_s": 9.42477796076938,
      "powerDeviceId": "battery"
    },
    {
      "deviceId": "actuator-right_knee",
      "deviceType": "actuator",
      "model": "AIDCRobotics.Actuators.IdealTorque",
      "jointId": "right_knee",
      "commandKind": "torque",
      "gearRatio": 320,
      "rotorInertia_kg_m2": 0.0005,
      "viscousDamping_Nm_s_rad": 0.001,
      "effortLimit_Nm": 1.176798,
      "speedLimit_rad_s": 9.42477796076938,
      "powerDeviceId": "battery"
    },
    {
      "deviceId": "actuator-right_ankle",
      "deviceType": "actuator",
      "model": "AIDCRobotics.Actuators.IdealTorque",
      "jointId": "right_ankle",
      "commandKind": "torque",
      "gearRatio": 320,
      "rotorInertia_kg_m2": 0.0005,
      "viscousDamping_Nm_s_rad": 0.001,
      "effortLimit_Nm": 1.176798,
      "speedLimit_rad_s": 9.42477796076938,
      "powerDeviceId": "battery"
    },
    {
      "deviceId": "battery",
      "deviceType": "power",
      "model": "AIDCRobotics.Electrical.SimpleBatteryBus",
      "nominalVoltage_V": 6.4,
      "capacity_Ah": 1.8,
      "internalResistance_Ohm": 0.12,
      "currentLimit_A": 3.0
    }
  ]
}
